{
  "schemaVersion": "1.0.0",
  "templateStatus": "UNANSWERED_TEMPLATE",
  "sourceAudit": {
    "pullRequest": 123,
    "commit": "7593288932c66678311cf3ceeef791ada386ca3b",
    "catalog": "docs/audits/viva-provider-clarification-catalog.json"
  },
  "provenance": {
    "provider": "Viva CRM",
    "receivedAt": null,
    "receivedChannel": "NOT_RECEIVED",
    "answeringPerson": {
      "name": null,
      "role": null,
      "team": null
    },
    "answerDate": null,
    "productApiVersion": null,
    "environment": "UNKNOWN",
    "originalMessageSha256": null,
    "preservedOriginalReference": null,
    "attachments": []
  },
  "gateReview": [
    {
      "gateId": "realProviderWriter",
      "currentDecision": "NO-GO",
      "reviewedDecision": "NO-GO",
      "automaticTransition": false
    },
    {
      "gateId": "realProviderReadBack",
      "currentDecision": "NO-GO",
      "reviewedDecision": "NO-GO",
      "automaticTransition": false
    },
    {
      "gateId": "publicCallbackRoute",
      "currentDecision": "NO-GO",
      "reviewedDecision": "NO-GO",
      "automaticTransition": false
    },
    {
      "gateId": "callbackAsAccelerationOnly",
      "currentDecision": "NO-GO",
      "reviewedDecision": "NO-GO",
      "automaticTransition": false
    },
    {
      "gateId": "providerNativeAmountCurrencyVerification",
      "currentDecision": "NO-GO",
      "reviewedDecision": "NO-GO",
      "automaticTransition": false
    },
    {
      "gateId": "livePaymentConvergence",
      "currentDecision": "NO-GO",
      "reviewedDecision": "NO-GO",
      "automaticTransition": false
    },
    {
      "gateId": "SHADOW",
      "currentDecision": "NO-GO",
      "reviewedDecision": "NO-GO",
      "automaticTransition": false
    },
    {
      "gateId": "WARN",
      "currentDecision": "NO-GO",
      "reviewedDecision": "NO-GO",
      "automaticTransition": false
    },
    {
      "gateId": "BLOCK",
      "currentDecision": "NO-GO",
      "reviewedDecision": "NO-GO",
      "automaticTransition": false
    }
  ],
  "questions": [
    {
      "questionId": "VIVA-Q-01",
      "questionEn": "After the exact create-booking/create-transaction/payment request is accepted, but the TCP/TLS connection closes before PadlHub receives the response body, which merchant-controlled value supplied before that request retrieves precisely that object without repeating the create command?",
      "questionRu": "После того как точный запрос create-booking/create-transaction/payment принят, но TCP/TLS-соединение закрывается до получения PadlHub тела ответа, какое управляемое мерчантом значение, переданное до запроса, позволяет получить именно созданный объект без повторения команды create?",
      "requirementIds": ["ID-01", "ID-05", "IDEM-05"],
      "gateIds": ["realProviderWriter", "realProviderReadBack"],
      "providerAnswer": null,
      "answerStatus": "NO_RESPONSE",
      "answeringPerson": { "name": null, "role": null, "team": null },
      "answerDate": null,
      "productApiVersion": null,
      "environment": "UNKNOWN",
      "authoritativeDocumentUrls": [],
      "attachedDocumentIdentifiers": [],
      "exactEndpointMethod": null,
      "exactRequestHeadersFields": [],
      "exactResponseFieldsStatusCodes": [],
      "retentionConsistencyRetryWindows": null,
      "securityMechanism": null,
      "limitationsExceptions": null,
      "evidenceBasis": "NONE",
      "contradictoryStatements": [],
      "evidenceReviewerConclusion": "NOT_REVIEWED",
      "mappedRequirementStatus": null,
      "mappedGateImpact": "NO_CHANGE_NO_GO"
    },
    {
      "questionId": "VIVA-Q-02",
      "questionEn": "For that exact create operation, what is the idempotency header or field, uniqueness scope and retention; what happens for same key/same payload, same key/changed payload, timeout/reset, and a retry after the retention window?",
      "questionRu": "Для этой точной операции create укажите header или field идемпотентности, область уникальности и срок хранения; что происходит при одинаковом ключе и payload, одинаковом ключе и изменённом payload, timeout/reset и повторе после окончания срока хранения?",
      "requirementIds": ["IDEM-01", "IDEM-02", "IDEM-03", "IDEM-04", "IDEM-05"],
      "gateIds": ["realProviderWriter"],
      "providerAnswer": null,
      "answerStatus": "NO_RESPONSE",
      "answeringPerson": { "name": null, "role": null, "team": null },
      "answerDate": null,
      "productApiVersion": null,
      "environment": "UNKNOWN",
      "authoritativeDocumentUrls": [],
      "attachedDocumentIdentifiers": [],
      "exactEndpointMethod": null,
      "exactRequestHeadersFields": [],
      "exactResponseFieldsStatusCodes": [],
      "retentionConsistencyRetryWindows": null,
      "securityMechanism": null,
      "limitationsExceptions": null,
      "evidenceBasis": "NONE",
      "contradictoryStatements": [],
      "evidenceReviewerConclusion": "NOT_REVIEWED",
      "mappedRequirementStatus": null,
      "mappedGateImpact": "NO_CHANGE_NO_GO"
    },
    {
      "questionId": "VIVA-Q-03",
      "questionEn": "Which current production read endpoint looks up the object by that merchant-controlled value; can it return multiple matches; and how are never-created, not-yet-visible, deleted, expired and rejected distinguished? State the consistency window, history retention and rate limits.",
      "questionRu": "Какой текущий production read endpoint ищет объект по этому управляемому мерчантом значению; может ли он вернуть несколько совпадений; как различаются never-created, not-yet-visible, deleted, expired и rejected? Укажите окно консистентности, срок хранения истории и rate limits.",
      "requirementIds": ["ID-05", "RB-01", "RB-02", "RB-05", "PAY-08"],
      "gateIds": ["realProviderWriter", "realProviderReadBack", "SHADOW", "WARN", "BLOCK"],
      "providerAnswer": null,
      "answerStatus": "NO_RESPONSE",
      "answeringPerson": { "name": null, "role": null, "team": null },
      "answerDate": null,
      "productApiVersion": null,
      "environment": "UNKNOWN",
      "authoritativeDocumentUrls": [],
      "attachedDocumentIdentifiers": [],
      "exactEndpointMethod": null,
      "exactRequestHeadersFields": [],
      "exactResponseFieldsStatusCodes": [],
      "retentionConsistencyRetryWindows": null,
      "securityMechanism": null,
      "limitationsExceptions": null,
      "evidenceBasis": "NONE",
      "contradictoryStatements": [],
      "evidenceReviewerConclusion": "NOT_REVIEWED",
      "mappedRequirementStatus": null,
      "mappedGateImpact": "NO_CHANGE_NO_GO"
    },
    {
      "questionId": "VIVA-Q-04",
      "questionEn": "List every provider-generated order, booking, payment and transaction identifier, when it first exists, where it appears in create response/read-back/callback, its scope, reuse rules and production/demo differences.",
      "questionRu": "Перечислите все генерируемые провайдером идентификаторы order, booking, payment и transaction: когда каждый впервые появляется, где присутствует в create response/read-back/callback, его область, правила повторного использования и различия production/demo.",
      "requirementIds": ["ID-02", "ID-04", "ENV-01"],
      "gateIds": ["realProviderWriter", "realProviderReadBack", "WARN"],
      "providerAnswer": null,
      "answerStatus": "NO_RESPONSE",
      "answeringPerson": { "name": null, "role": null, "team": null },
      "answerDate": null,
      "productApiVersion": null,
      "environment": "UNKNOWN",
      "authoritativeDocumentUrls": [],
      "attachedDocumentIdentifiers": [],
      "exactEndpointMethod": null,
      "exactRequestHeadersFields": [],
      "exactResponseFieldsStatusCodes": [],
      "retentionConsistencyRetryWindows": null,
      "securityMechanism": null,
      "limitationsExceptions": null,
      "evidenceBasis": "NONE",
      "contradictoryStatements": [],
      "evidenceReviewerConclusion": "NOT_REVIEWED",
      "mappedRequirementStatus": null,
      "mappedGateImpact": "NO_CHANGE_NO_GO"
    },
    {
      "questionId": "VIVA-Q-05",
      "questionEn": "Provide the current production state machine and identify terminal/reversible statuses for accepted, rejected, failed, cancelled, expired, authorized, captured, settled, refunded, partially refunded, reversed and charged back.",
      "questionRu": "Предоставьте текущую production state machine и укажите terminal/reversible статусы для accepted, rejected, failed, cancelled, expired, authorized, captured, settled, refunded, partially refunded, reversed и charged back.",
      "requirementIds": ["RB-03", "PAY-03", "PAY-07"],
      "gateIds": ["realProviderReadBack", "livePaymentConvergence"],
      "providerAnswer": null,
      "answerStatus": "NO_RESPONSE",
      "answeringPerson": { "name": null, "role": null, "team": null },
      "answerDate": null,
      "productApiVersion": null,
      "environment": "UNKNOWN",
      "authoritativeDocumentUrls": [],
      "attachedDocumentIdentifiers": [],
      "exactEndpointMethod": null,
      "exactRequestHeadersFields": [],
      "exactResponseFieldsStatusCodes": [],
      "retentionConsistencyRetryWindows": null,
      "securityMechanism": null,
      "limitationsExceptions": null,
      "evidenceBasis": "NONE",
      "contradictoryStatements": [],
      "evidenceReviewerConclusion": "NOT_REVIEWED",
      "mappedRequirementStatus": null,
      "mappedGateImpact": "NO_CHANGE_NO_GO"
    },
    {
      "questionId": "VIVA-Q-06",
      "questionEn": "Which immutable read-back fields bind merchant/tenant, actor/client, exercise/game, booking/order/payment, merchant reference and provider transaction to the same operation?",
      "questionRu": "Какие неизменяемые поля read-back связывают merchant/tenant, actor/client, exercise/game, booking/order/payment, merchant reference и provider transaction с одной и той же операцией?",
      "requirementIds": ["RB-04", "PAY-05"],
      "gateIds": [
        "realProviderReadBack",